20:54:41.629752 IP 172.20.10.4.57532 > r-199-59-148-21.twttr.com.https: Flags [.], seq 381262918:381264316, ack 1001199173, win 4194, options [nop,nop,TS val 709384122 ecr 2764541341], length 1398
20:54:41.629798 IP 172.20.10.4.57532 > r-199-59-148-21.twttr.com.https: Flags [P.], seq 1398:1509, ack 1, win 4194, options [nop,nop,TS val 709384122 ecr 2764541341], length 111
20:54:41.630720 IP 172.20.10.4.57532 > r-199-59-148-21.twttr.com.https: Flags [.], seq 1509:2907, ack 1, win 4194, options [nop,nop,TS val 709384123 ecr 2764541341], length 1398
20:54:41.630756 IP 172.20.10.4.57532 > r-199-59-148-21.twttr.com.https: Flags [P.], seq 2907:3002, ack 1, win 4194, options [nop,nop,TS val 709384123 ecr 2764541341], length 95
20:54:41.705445 IP 172.20.10.4.64421 > 172.20.10.1.domain: 16415+ PTR? 21.148.59.199.in-addr.arpa. (44)
20:54:41.840867 IP r-199-59-148-21.twttr.com.https > 172.20.10.4.57532: Flags [.], ack 1509, win 1701, options [nop,nop,TS val 2764543337 ecr 709384122], length 0
20:54:41.840923 IP 172.20.10.4.57532 > r-199-59-148-21.twttr.com.https: Flags [.], seq 3002:4400, ack 1, win 4194, options [nop,nop,TS val 709384331 ecr 2764543337], length 1398
20:54:41.840970 IP 172.20.10.4.57532 > r-199-59-148-21.twttr.com.https: Flags [.], seq 4400:5798, ack 1, win 4194, options [nop,nop,TS val 709384331 ecr 2764543337], length 1398
20:54:41.841002 IP 172.20.10.4.57532 > r-199-59-148-21.twttr.com.https: Flags [.], seq 5798:7196, ack 1, win 4194, options [nop,nop,TS val 709384331 ecr 2764543337], length 1398
20:54:41.841343 IP r-199-59-148-21.twttr.com.https > 172.20.10.4.57532: Flags [.], ack 3002, win 1700, options [nop,nop,TS val 2764543338 ecr 709384123], length 0
20:54:41.841374 IP 172.20.10.4.57532 > r-199-59-148-21.twttr.com.https: Flags [.], seq 7196:8594, ack 1, win 4194, options [nop,nop,TS val 709384331 ecr 2764543338], length 1398
20:54:41.841404 IP 172.20.10.4.57532 > r-199-59-148-21.twttr.com.https: Flags [.], seq 8594:9992, ack 1, win 4194, options [nop,nop,TS val 709384331 ecr 2764543338], length 1398
20:54:41.877026 IP r-199-59-148-21.twttr.com.https > 172.20.10.4.57532: Flags [P.], seq 1:630, ack 3002, win 1701, options [nop,nop,TS val 2764543373 ecr 709384123], length 629
20:54:41.877121 IP 172.20.10.4.57532 > r-199-59-148-21.twttr.com.https: Flags [.], seq 9992:10384, ack 630, win 4174, options [nop,nop,TS val 709384367 ecr 2764543373], length 392
20:54:41.878122 IP r-199-59-148-21.twttr.com.https > 172.20.10.4.57532: Flags [P.], seq 630:859, ack 3002, win 1701, options [nop,nop,TS val 2764543374 ecr 709384123], length 229
20:54:41.878183 IP 172.20.10.4.57532 > r-199-59-148-21.twttr.com.https: Flags [.], ack 859, win 4186, options [nop,nop,TS val 709384368 ecr 2764543374], length 0
20:54:41.878218 IP r-199-59-148-21.twttr.com.https > 172.20.10.4.57532: Flags [P.], seq 859:1040, ack 3002, win 1701, options [nop,nop,TS val 2764543374 ecr 709384123], length 181
20:54:41.878244 IP 172.20.10.4.57532 > r-199-59-148-21.twttr.com.https: Flags [.], ack 1040, win 4181, options [nop,nop,TS val 709384368 ecr 2764543374], length 0
20:54:41.878252 IP r-199-59-148-21.twttr.com.https > 172.20.10.4.57532: Flags [.], seq 1040:2438, ack 3002, win 1701, options [nop,nop,TS val 2764543374 ecr 709384123], length 1398
20:54:41.886631 IP r-199-59-148-21.twttr.com.https > 172.20.10.4.57532: Flags [P.], seq 2438:2549, ack 3002, win 1701, options [nop,nop,TS val 2764543374 ecr 709384123], length 111
20:54:41.886679 IP 172.20.10.4.57532 > r-199-59-148-21.twttr.com.https: Flags [.], ack 2549, win 4190, options [nop,nop,TS val 709384376 ecr 2764543374], length 0
20:54:41.921175 IP 199.16.156.81.https > 172.20.10.4.57545: Flags [P.], seq 2556537225:2556537278, ack 2515226720, win 72, options [nop,nop,TS val 2322924666 ecr 709380999], length 53
20:54:41.921247 IP 172.20.10.4.57545 > 199.16.156.81.https: Flags [.], ack 53, win 4094, options [nop,nop,TS val 709384410 ecr 2322924666], length 0
20:54:41.921282 IP 199.16.156.81.https > 172.20.10.4.57545: Flags [P.], seq 53:106, ack 1, win 72, options [nop,nop,TS val 2322924666 ecr 709380999], length 53
20:54:41.921306 IP 172.20.10.4.57545 > 199.16.156.81.https: Flags [.], ack 106, win 4094, options [nop,nop,TS val 709384410 ecr 2322924666], length 0
20:54:41.921843 IP 199.16.156.81.https > 172.20.10.4.57545: Flags [P.], seq 106:159, ack 1, win 72, options [nop,nop,TS val 2322924666 ecr 709380999], length 53
20:54:41.921872 IP 172.20.10.4.57545 > 199.16.156.81.https: Flags [.], ack 159, win 4094, options [nop,nop,TS val 709384410 ecr 2322924666], length 0
20:54:42.029146 IP r-199-59-148-21.twttr.com.https > 172.20.10.4.57532: Flags [.], ack 5798, win 1701, options [nop,nop,TS val 2764543517 ecr 709384331], length 0
20:54:42.029200 IP 172.20.10.4.57532 > r-199-59-148-21.twttr.com.https: Flags [P.], seq 10384:10707, ack 2549, win 4194, options [nop,nop,TS val 709384516 ecr 2764543517], length 323
20:54:42.032730 IP r-199-59-148-21.twttr.com.https > 172.20.10.4.57532: Flags [.], ack 8594, win 1701, options [nop,nop,TS val 2764543521 ecr 709384331], length 0
20:54:42.035769 IP r-199-59-148-21.twttr.com.https > 172.20.10.4.57532: Flags [.], ack 10384, win 1701, options [nop,nop,TS val 2764543532 ecr 709384331], length 0
20:54:42.043771 IP yv-in-f141.1e100.net.https > 172.20.10.4.57566: Flags [P.], seq 1784982655:1784982718, ack 37793459, win 350, options [nop,nop,TS val 805978413 ecr 709152168], length 63
20:54:42.043835 IP 172.20.10.4.57566 > yv-in-f141.1e100.net.https: Flags [.], ack 63, win 4095, options [nop,nop,TS val 709384530 ecr 805978413], length 0
20:54:42.043876 IP yv-in-f141.1e100.net.https > 172.20.10.4.57566: Flags [F.], seq 63, ack 1, win 350, options [nop,nop,TS val 805978413 ecr 709152168], length 0
20:54:42.043906 IP 172.20.10.4.57566 > yv-in-f141.1e100.net.https: Flags [.], ack 64, win 4095, options [nop,nop,TS val 709384530 ecr 805978413], length 0
20:54:42.044181 IP 172.20.10.4.57566 > yv-in-f141.1e100.net.https: Flags [F.], seq 1, ack 64, win 4096, options [nop,nop,TS val 709384530 ecr 805978413], length 0
20:54:42.050779 IP r-199-59-148-21.twttr.com.https > 172.20.10.4.57532: Flags [P.], seq 2549:3066, ack 10384, win 1701, options [nop,nop,TS val 2764543546 ecr 709384376], length 517
20:54:42.050837 IP 172.20.10.4.57532 > r-199-59-148-21.twttr.com.https: Flags [.], ack 3066, win 4177, options [nop,nop,TS val 709384537 ecr 2764543546], length 0
20:54:42.050877 IP r-199-59-148-21.twttr.com.https > 172.20.10.4.57532: Flags [P.], seq 3066:3279, ack 10384, win 1701, options [nop,nop,TS val 2764543546 ecr 709384376], length 213
20:54:42.050906 IP 172.20.10.4.57532 > r-199-59-148-21.twttr.com.https: Flags [.], ack 3279, win 4171, options [nop,nop,TS val 709384537 ecr 2764543546], length 0
20:54:42.053357 IP r-199-59-148-21.twttr.com.https > 172.20.10.4.57532: Flags [P.], seq 3279:3476, ack 10384, win 1701, options [nop,nop,TS val 2764543549 ecr 709384376], length 197
20:54:42.053402 IP 172.20.10.4.57532 > r-199-59-148-21.twttr.com.https: Flags [.], ack 3476, win 4187, options [nop,nop,TS val 709384539 ecr 2764543549], length 0
20:54:42.054374 IP r-199-59-148-21.twttr.com.https > 172.20.10.4.57532: Flags [P.], seq 3476:3705, ack 10384, win 1701, options [nop,nop,TS val 2764543549 ecr 709384376], length 229
20:54:42.054402 IP 172.20.10.4.57532 > r-199-59-148-21.twttr.com.https: Flags [.], ack 3705, win 4186, options [nop,nop,TS val 709384540 ecr 2764543549], length 0
20:54:42.068108 IP r-199-59-148-21.twttr.com.https > 172.20.10.4.57532: Flags [P.], seq 3705:4190, ack 10384, win 1701, options [nop,nop,TS val 2764543563 ecr 709384376], length 485
20:54:42.068159 IP 172.20.10.4.57532 > r-199-59-148-21.twttr.com.https: Flags [.], ack 4190, win 4178, options [nop,nop,TS val 709384553 ecr 2764543563], length 0
20:54:42.069099 IP r-199-59-148-21.twttr.com.https > 172.20.10.4.57532: Flags [P.], seq 4190:4403, ack 10384, win 1701, options [nop,nop,TS val 2764543564 ecr 709384376], length 213
20:54:42.069127 IP 172.20.10.4.57532 > r-199-59-148-21.twttr.com.https: Flags [.], ack 4403, win 4187, options [nop,nop,TS val 709384553 ecr 2764543564], length 0
20:54:42.076014 IP 199.16.156.81.https > 172.20.10.4.57548: Flags [P.], seq 2448194170:2448194223, ack 1744673381, win 72, options [nop,nop,TS val 2325992672 ecr 709379568], length 53
20:54:42.076064 IP 172.20.10.4.57548 > 199.16.156.81.https: Flags [.], ack 53, win 4094, options [nop,nop,TS val 709384560 ecr 2325992672], length 0
20:54:42.076093 IP 199.16.156.81.https > 172.20.10.4.57548: Flags [P.], seq 53:106, ack 1, win 72, options [nop,nop,TS val 2325992672 ecr 709379568], length 53
20:54:42.076109 IP 172.20.10.4.57548 > 199.16.156.81.https: Flags [.], ack 106, win 4092, options [nop,nop,TS val 709384560 ecr 2325992672], length 0
20:54:42.076746 IP 199.16.156.81.https > 172.20.10.4.57548: Flags [P.], seq 106:159, ack 1, win 72, options [nop,nop,TS val 2325992672 ecr 709379568], length 53
20:54:42.076765 IP 172.20.10.4.57548 > 199.16.156.81.https: Flags [.], ack 159, win 4094, options [nop,nop,TS val 709384560 ecr 2325992672], length 0
20:54:42.096667 IP r-199-59-148-21.twttr.com.https > 172.20.10.4.57532: Flags [P.], seq 4403:4840, ack 10384, win 1701, options [nop,nop,TS val 2764543593 ecr 709384376], length 437
20:54:42.096726 IP 172.20.10.4.57532 > r-199-59-148-21.twttr.com.https: Flags [.], ack 4840, win 4180, options [nop,nop,TS val 709384580 ecr 2764543593], length 0
20:54:42.097533 IP r-199-59-148-21.twttr.com.https > 172.20.10.4.57532: Flags [P.], seq 4840:6077, ack 10384, win 1701, options [nop,nop,TS val 2764543593 ecr 709384376], length 1237
20:54:42.097553 IP 172.20.10.4.57532 > r-199-59-148-21.twttr.com.https: Flags [.], ack 6077, win 4155, options [nop,nop,TS val 709384580 ecr 2764543593], length 0
20:54:42.156652 IP yv-in-f141.1e100.net.https > 172.20.10.4.57566: Flags [.], ack 2, win 350, options [nop,nop,TS val 805978525 ecr 709384530], length 0
20:54:42.235194 IP r-199-59-148-21.twttr.com.https > 172.20.10.4.57532: Flags [P.], seq 6077:6466, ack 10707, win 1701, options [nop,nop,TS val 2764543731 ecr 709384516], length 389
20:54:42.235261 IP 172.20.10.4.57532 > r-199-59-148-21.twttr.com.https: Flags [.], ack 6466, win 4181, options [nop,nop,TS val 709384717 ecr 2764543731], length 0
20:54:42.235288 IP r-199-59-148-21.twttr.com.https > 172.20.10.4.57532: Flags [.], seq 6466:7864, ack 10707, win 1701, options [nop,nop,TS val 2764543732 ecr 709384516], length 1398
20:54:42.235895 IP r-199-59-148-21.twttr.com.https > 172.20.10.4.57532: Flags [P.], seq 7864:8135, ack 10707, win 1701, options [nop,nop,TS val 2764543732 ecr 709384516], length 271
20:54:42.235934 IP 172.20.10.4.57532 > r-199-59-148-21.twttr.com.https: Flags [.], ack 8135, win 4185, options [nop,nop,TS val 709384717 ecr 2764543732], length 0
20:54:42.501826 IP 172.20.10.4.57423 > ec2-54-166-236-72.compute-1.amazonaws.com.http: Flags [FP.], seq 2435157680:2435157814, ack 1261481090, win 4104, options [nop,nop,TS val 709384982 ecr 48638392], length 134
20:54:42.707473 IP 172.20.10.4.64421 > 172.20.10.1.domain: 16415+ PTR? 21.148.59.199.in-addr.arpa. (44)
20:54:44.262495 IP 172.20.10.4.57421 > ec2-54-166-236-72.compute-1.amazonaws.com.http: Flags [FP.], seq 2824845104:2824845234, ack 1461105125, win 4105, options [nop,nop,TS val 709386741 ecr 48638381], length 130
20:54:44.700187 IP 172.20.10.4.47058 > 172.20.10.1.domain: 35381+ A? play.google.com. (33)
20:54:44.781826 IP 172.20.10.1.domain > 172.20.10.4.47058: 35381 2/0/0 CNAME play.l.google.com., A 216.58.192.110 (70)
20:54:44.784035 IP 172.20.10.4.57841 > mia07s35-in-f110.1e100.net.https: Flags [S], seq 1046069607, win 65535, options [mss 1460,nop,wscale 5,nop,nop,TS val 709387261 ecr 0,sackOK,eol], length 0
20:54:44.785003 IP 172.20.10.4.57152 > ec2-54-160-65-226.compute-1.amazonaws.com.http: Flags [P.], seq 2687720764:2687720894, ack 1580003499, win 4096, options [nop,nop,TS val 709387262 ecr 48972589], length 130
20:54:44.785092 IP 172.20.10.4.57159 > ec2-54-160-65-226.compute-1.amazonaws.com.http: Flags [P.], seq 65034921:65035051, ack 2312453222, win 4096, options [nop,nop,TS val 709387262 ecr 48972587], length 130
20:54:44.858881 IP mia07s35-in-f110.1e100.net.https > 172.20.10.4.57841: Flags [S.], seq 4166646421, ack 1046069608, win 42540, options [mss 1410,sackOK,TS val 1527215613 ecr 709387261,nop,wscale 7], length 0
20:54:44.859036 IP 172.20.10.4.57841 > mia07s35-in-f110.1e100.net.https: Flags [.], ack 1, win 4106, options [nop,nop,TS val 709387335 ecr 1527215613], length 0
20:54:44.859379 IP 172.20.10.4.57841 > mia07s35-in-f110.1e100.net.https: Flags [P.], seq 1:209, ack 1, win 4106, options [nop,nop,TS val 709387335 ecr 1527215613], length 208
20:54:44.895220 IP ec2-54-160-65-226.compute-1.amazonaws.com.http > 172.20.10.4.57159: Flags [P.], seq 1:41, ack 130, win 88, options [nop,nop,TS val 48989355 ecr 709387262], length 40
20:54:44.895299 IP 172.20.10.4.57159 > ec2-54-160-65-226.compute-1.amazonaws.com.http: Flags [.], ack 41, win 4094, options [nop,nop,TS val 709387370 ecr 48989355], length 0
20:54:44.897830 IP ec2-54-160-65-226.compute-1.amazonaws.com.http > 172.20.10.4.57152: Flags [P.], seq 1:52, ack 130, win 117, options [nop,nop,TS val 48989358 ecr 709387262], length 51
20:54:44.897870 IP 172.20.10.4.57152 > ec2-54-160-65-226.compute-1.amazonaws.com.http: Flags [.], ack 52, win 4094, options [nop,nop,TS val 709387372 ecr 48989358], length 0
20:54:44.939426 IP mia07s35-in-f110.1e100.net.https > 172.20.10.4.57841: Flags [.], ack 209, win 341, options [nop,nop,TS val 1527215693 ecr 709387335], length 0
20:54:44.939489 IP mia07s35-in-f110.1e100.net.https > 172.20.10.4.57841: Flags [.], seq 1:1399, ack 209, win 341, options [nop,nop,TS val 1527215693 ecr 709387335], length 1398
20:54:44.939548 IP mia07s35-in-f110.1e100.net.https > 172.20.10.4.57841: Flags [.], seq 1399:2797, ack 209, win 341, options [nop,nop,TS val 1527215693 ecr 709387335], length 1398
20:54:44.939672 IP 172.20.10.4.57841 > mia07s35-in-f110.1e100.net.https: Flags [.], ack 2797, win 4019, options [nop,nop,TS val 709387413 ecr 1527215693], length 0
20:54:44.940188 IP mia07s35-in-f110.1e100.net.https > 172.20.10.4.57841: Flags [P.], seq 2797:4097, ack 209, win 341, options [nop,nop,TS val 1527215693 ecr 709387335], length 1300
20:54:44.940244 IP 172.20.10.4.57841 > mia07s35-in-f110.1e100.net.https: Flags [.], ack 4097, win 4055, options [nop,nop,TS val 709387413 ecr 1527215693], length 0
20:54:44.940933 IP mia07s35-in-f110.1e100.net.https > 172.20.10.4.57841: Flags [P.], seq 4097:4409, ack 209, win 341, options [nop,nop,TS val 1527215694 ecr 709387335], length 312
20:54:44.940970 IP 172.20.10.4.57841 > mia07s35-in-f110.1e100.net.https: Flags [.], ack 4409, win 4086, options [nop,nop,TS val 709387414 ecr 1527215694], length 0
20:54:44.942608 IP 172.20.10.4.57841 > mia07s35-in-f110.1e100.net.https: Flags [P.], seq 209:335, ack 4409, win 4096, options [nop,nop,TS val 709387415 ecr 1527215694], length 126
20:54:45.036468 IP mia07s35-in-f110.1e100.net.https > 172.20.10.4.57841: Flags [P.], seq 4409:4655, ack 335, win 341, options [nop,nop,TS val 1527215791 ecr 709387415], length 246
20:54:45.036548 IP 172.20.10.4.57841 > mia07s35-in-f110.1e100.net.https: Flags [P.], seq 335:1593, ack 4655, win 4088, options [nop,nop,TS val 709387508 ecr 1527215791], length 1258
20:54:45.037211 IP mia07s35-in-f110.1e100.net.https > 172.20.10.4.57841: Flags [P.], seq 4655:4711, ack 335, win 341, options [nop,nop,TS val 1527215791 ecr 709387415], length 56
20:54:45.037259 IP 172.20.10.4.57841 > mia07s35-in-f110.1e100.net.https: Flags [.], ack 4711, win 4094, options [nop,nop,TS val 709387508 ecr 1527215791], length 0
20:54:45.038215 IP mia07s35-in-f110.1e100.net.https > 172.20.10.4.57841: Flags [P.], seq 4711:4753, ack 335, win 341, options [nop,nop,TS val 1527215791 ecr 709387415], length 42
20:54:45.038256 IP 172.20.10.4.57841 > mia07s35-in-f110.1e100.net.https: Flags [P.], seq 1593:1631, ack 4753, win 4094, options [nop,nop,TS val 709387509 ecr 1527215791], length 38
20:54:45.144591 IP mia07s35-in-f110.1e100.net.https > 172.20.10.4.57841: Flags [.], ack 1631, win 361, options [nop,nop,TS val 1527215890 ecr 709387508], length 0
20:54:45.144642 IP mia07s35-in-f110.1e100.net.https > 172.20.10.4.57841: Flags [P.], seq 4753:4791, ack 1631, win 361, options [nop,nop,TS val 1527215892 ecr 709387508], length 38
20:54:45.144677 IP 172.20.10.4.57841 > mia07s35-in-f110.1e100.net.https: Flags [.], ack 4791, win 4094, options [nop,nop,TS val 709387615 ecr 1527215892], length 0
20:54:45.174687 IP mia07s35-in-f110.1e100.net.https > 172.20.10.4.57841: Flags [P.], seq 4791:5170, ack 1631, win 361, options [nop,nop,TS val 1527215930 ecr 709387508], length 379
20:54:45.174743 IP 172.20.10.4.57841 > mia07s35-in-f110.1e100.net.https: Flags [.], ack 5170, win 4084, options [nop,nop,TS val 709387644 ecr 1527215930], length 0
20:54:45.174766 IP mia07s35-in-f110.1e100.net.https > 172.20.10.4.57841: Flags [P.], seq 5170:5208, ack 1631, win 361, options [nop,nop,TS val 1527215930 ecr 709387508], length 38
20:54:45.174787 IP 172.20.10.4.57841 > mia07s35-in-f110.1e100.net.https: Flags [.], ack 5208, win 4082, options [nop,nop,TS val 709387644 ecr 1527215930], length 0
20:54:45.175442 IP mia07s35-in-f110.1e100.net.https > 172.20.10.4.57841: Flags [P.], seq 5208:5254, ack 1631, win 361, options [nop,nop,TS val 1527215930 ecr 709387508], length 46
20:54:45.175469 IP 172.20.10.4.57841 > mia07s35-in-f110.1e100.net.https: Flags [.], ack 5254, win 4094, options [nop,nop,TS val 709387644 ecr 1527215930], length 0
20:54:45.175701 IP 172.20.10.4.57841 > mia07s35-in-f110.1e100.net.https: Flags [P.], seq 1631:1677, ack 5254, win 4096, options [nop,nop,TS val 709387644 ecr 1527215930], length 46
20:54:45.181438 IP 172.20.10.4.57843 > mia07s35-in-f110.1e100.net.https: Flags [S], seq 2240250520, win 65535, options [mss 1460,nop,wscale 5,nop,nop,TS val 709387650 ecr 0,sackOK,eol], length 0
20:54:45.259219 IP mia07s35-in-f110.1e100.net.https > 172.20.10.4.57843: Flags [S.], seq 2369488195, ack 2240250521, win 42540, options [mss 1410,sackOK,TS val 1528232438 ecr 709387650,nop,wscale 7], length 0
20:54:45.259278 IP 172.20.10.4.57843 > mia07s35-in-f110.1e100.net.https: Flags [.], ack 1, win 4106, options [nop,nop,TS val 709387726 ecr 1528232438], length 0
20:54:45.259398 IP 172.20.10.4.57843 > mia07s35-in-f110.1e100.net.https: Flags [P.], seq 1:213, ack 1, win 4106, options [nop,nop,TS val 709387726 ecr 1528232438], length 212
20:54:45.299232 IP mia07s35-in-f110.1e100.net.https > 172.20.10.4.57841: Flags [.], ack 1677, win 361, options [nop,nop,TS val 1527216053 ecr 709387644], length 0
20:54:45.299297 IP 172.20.10.4.57841 > mia07s35-in-f110.1e100.net.https: Flags [P.], seq 1677:1853, ack 5254, win 4096, options [nop,nop,TS val 709387765 ecr 1527216053], length 176
20:54:45.312322 IP 172.20.10.1.domain > 172.20.10.4.64421: 16415 1/0/0 PTR r-199-59-148-21.twttr.com. (83)
20:54:45.339848 IP mia07s35-in-f110.1e100.net.https > 172.20.10.4.57843: Flags [.], ack 213, win 341, options [nop,nop,TS val 1528232518 ecr 709387726], length 0
20:54:45.340585 IP mia07s35-in-f110.1e100.net.https > 172.20.10.4.57843: Flags [.], seq 1:1399, ack 213, win 341, options [nop,nop,TS val 1528232519 ecr 709387726], length 1398
20:54:45.340635 IP mia07s35-in-f110.1e100.net.https > 172.20.10.4.57843: Flags [.], seq 1399:2797, ack 213, win 341, options [nop,nop,TS val 1528232519 ecr 709387726], length 1398
20:54:45.340670 IP 172.20.10.4.57843 > mia07s35-in-f110.1e100.net.https: Flags [.], ack 2797, win 4019, options [nop,nop,TS val 709387805 ecr 1528232519], length 0
20:54:45.341557 IP mia07s35-in-f110.1e100.net.https > 172.20.10.4.57843: Flags [P.], seq 2797:4097, ack 213, win 341, options [nop,nop,TS val 1528232519 ecr 709387726], length 1300
20:54:45.341609 IP 172.20.10.4.57843 > mia07s35-in-f110.1e100.net.https: Flags [.], ack 4097, win 4055, options [nop,nop,TS val 709387806 ecr 1528232519], length 0
20:54:45.342523 IP mia07s35-in-f110.1e100.net.https > 172.20.10.4.57843: Flags [P.], seq 4097:4413, ack 213, win 341, options [nop,nop,TS val 1528232519 ecr 709387726], length 316
20:54:45.342562 IP 172.20.10.4.57843 > mia07s35-in-f110.1e100.net.https: Flags [.], ack 4413, win 4086, options [nop,nop,TS val 709387806 ecr 1528232519], length 0
20:54:45.343983 IP 172.20.10.4.57843 > mia07s35-in-f110.1e100.net.https: Flags [P.], seq 213:504, ack 4413, win 4096, options [nop,nop,TS val 709387808 ecr 1528232519], length 291
20:54:45.346104 IP 172.20.10.4.57843 > mia07s35-in-f110.1e100.net.https: Flags [.], seq 504:1902, ack 4413, win 4096, options [nop,nop,TS val 709387809 ecr 1528232519], length 1398
20:54:45.346149 IP 172.20.10.4.57843 > mia07s35-in-f110.1e100.net.https: Flags [P.], seq 1902:2697, ack 4413, win 4096, options [nop,nop,TS val 709387809 ecr 1528232519], length 795
20:54:45.346188 IP 172.20.10.4.57843 > mia07s35-in-f110.1e100.net.https: Flags [.], seq 2697:4095, ack 4413, win 4096, options [nop,nop,TS val 709387809 ecr 1528232519], length 1398
20:54:45.346214 IP 172.20.10.4.57843 > mia07s35-in-f110.1e100.net.https: Flags [P.], seq 4095:4745, ack 4413, win 4096, options [nop,nop,TS val 709387809 ecr 1528232519], length 650
20:54:45.377835 IP mia07s35-in-f110.1e100.net.https > 172.20.10.4.57841: Flags [.], ack 1853, win 381, options [nop,nop,TS val 1527216133 ecr 709387765], length 0
20:54:45.417117 IP mia07s35-in-f110.1e100.net.https > 172.20.10.4.57841: Flags [P.], seq 5254:5384, ack 1853, win 381, options [nop,nop,TS val 1527216172 ecr 709387765], length 130
20:54:45.417222 IP 172.20.10.4.57841 > mia07s35-in-f110.1e100.net.https: Flags [.], ack 5384, win 4091, options [nop,nop,TS val 709387880 ecr 1527216172], length 0
20:54:45.417947 IP mia07s35-in-f110.1e100.net.https > 172.20.10.4.57841: Flags [P.], seq 5384:5422, ack 1853, win 381, options [nop,nop,TS val 1527216172 ecr 709387765], length 38
20:54:45.418026 IP 172.20.10.4.57841 > mia07s35-in-f110.1e100.net.https: Flags [.], ack 5422, win 4094, options [nop,nop,TS val 709387880 ecr 1527216172], length 0
20:54:45.418684 IP mia07s35-in-f110.1e100.net.https > 172.20.10.4.57841: Flags [P.], seq 5422:5468, ack 1853, win 381, options [nop,nop,TS val 1527216172 ecr 709387765], length 46
20:54:45.418733 IP 172.20.10.4.57841 > mia07s35-in-f110.1e100.net.https: Flags [.], ack 5468, win 4094, options [nop,nop,TS val 709387881 ecr 1527216172], length 0
20:54:45.419136 IP 172.20.10.4.57841 > mia07s35-in-f110.1e100.net.https: Flags [P.], seq 1853:1899, ack 5468, win 4096, options [nop,nop,TS val 709387881 ecr 1527216172], length 46
20:54:45.451656 IP mia07s35-in-f110.1e100.net.https > 172.20.10.4.57843: Flags [.], ack 1902, win 371, options [nop,nop,TS val 1528232622 ecr 709387808], length 0
20:54:45.451707 IP mia07s35-in-f110.1e100.net.https > 172.20.10.4.57843: Flags [.], ack 4095, win 415, options [nop,nop,TS val 1528232623 ecr 709387809], length 0
20:54:45.451717 IP mia07s35-in-f110.1e100.net.https > 172.20.10.4.57843: Flags [P.], seq 4413:4707, ack 4745, win 437, options [nop,nop,TS val 1528232623 ecr 709387809], length 294
20:54:45.451724 IP mia07s35-in-f110.1e100.net.https > 172.20.10.4.57843: Flags [P.], seq 4707:4763, ack 4745, win 437, options [nop,nop,TS val 1528232623 ecr 709387809], length 56
20:54:45.451780 IP 172.20.10.4.57843 > mia07s35-in-f110.1e100.net.https: Flags [P.], seq 4745:5596, ack 4707, win 4086, options [nop,nop,TS val 709387913 ecr 1528232623], length 851
20:54:45.451827 IP 172.20.10.4.57843 > mia07s35-in-f110.1e100.net.https: Flags [.], ack 4763, win 4085, options [nop,nop,TS val 709387913 ecr 1528232623], length 0
20:54:45.451844 IP mia07s35-in-f110.1e100.net.https > 172.20.10.4.57843: Flags [P.], seq 4763:4805, ack 4745, win 437, options [nop,nop,TS val 1528232623 ecr 709387809], length 42
20:54:45.451852 IP mia07s35-in-f110.1e100.net.https > 172.20.10.4.57843: Flags [P.], seq 4805:4843, ack 4745, win 437, options [nop,nop,TS val 1528232625 ecr 709387809], length 38
20:54:45.451879 IP 172.20.10.4.57843 > mia07s35-in-f110.1e100.net.https: Flags [.], ack 4805, win 4083, options [nop,nop,TS val 709387913 ecr 1528232623], length 0
20:54:45.451911 IP 172.20.10.4.57843 > mia07s35-in-f110.1e100.net.https: Flags [.], ack 4843, win 4082, options [nop,nop,TS val 709387913 ecr 1528232625], length 0
20:54:45.537984 IP mia07s35-in-f110.1e100.net.https > 172.20.10.4.57841: Flags [.], ack 1899, win 381, options [nop,nop,TS val 1527216293 ecr 709387881], length 0
20:54:45.567029 IP mia07s35-in-f110.1e100.net.https > 172.20.10.4.57843: Flags [.], ack 5596, win 459, options [nop,nop,TS val 1528232746 ecr 709387913], length 0
20:54:45.567097 IP 172.20.10.4.57843 > mia07s35-in-f110.1e100.net.https: Flags [P.], seq 5596:5634, ack 4843, win 4096, options [nop,nop,TS val 709388028 ecr 1528232746], length 38
20:54:45.575028 IP mia07s35-in-f110.1e100.net.https > 172.20.10.4.57843: Flags [P.], seq 4843:5139, ack 5596, win 459, options [nop,nop,TS val 1528232754 ecr 709387913], length 296
20:54:45.575101 IP 172.20.10.4.57843 > mia07s35-in-f110.1e100.net.https: Flags [.], ack 5139, win 4086, options [nop,nop,TS val 709388036 ecr 1528232754], length 0
20:54:45.575126 IP mia07s35-in-f110.1e100.net.https > 172.20.10.4.57843: Flags [P.], seq 5139:5241, ack 5596, win 459, options [nop,nop,TS val 1528232754 ecr 709387913], length 102
20:54:45.575145 IP 172.20.10.4.57843 > mia07s35-in-f110.1e100.net.https: Flags [.], ack 5241, win 4083, options [nop,nop,TS val 709388036 ecr 1528232754], length 0
20:54:45.575896 IP mia07s35-in-f110.1e100.net.https > 172.20.10.4.57843: Flags [P.], seq 5241:5287, ack 5596, win 459, options [nop,nop,TS val 1528232754 ecr 709387913], length 46
20:54:45.575935 IP 172.20.10.4.57843 > mia07s35-in-f110.1e100.net.https: Flags [.], ack 5287, win 4094, options [nop,nop,TS val 709388036 ecr 1528232754], length 0
20:54:45.609422 IP mia07s35-in-f110.1e100.net.https > 172.20.10.4.57843: Flags [P.], seq 5287:5357, ack 5596, win 459, options [nop,nop,TS val 1528232788 ecr 709387913], length 70
20:54:45.609524 IP 172.20.10.4.57843 > mia07s35-in-f110.1e100.net.https: Flags [P.], seq 5634:5680, ack 5357, win 4093, options [nop,nop,TS val 709388070 ecr 1528232788], length 46
20:54:45.609561 IP mia07s35-in-f110.1e100.net.https > 172.20.10.4.57843: Flags [P.], seq 5357:5489, ack 5596, win 459, options [nop,nop,TS val 1528232788 ecr 709387913], length 132
20:54:45.609592 IP 172.20.10.4.57843 > mia07s35-in-f110.1e100.net.https: Flags [.], ack 5489, win 4089, options [nop,nop,TS val 709388070 ecr 1528232788], length 0
20:54:45.610267 IP mia07s35-in-f110.1e100.net.https > 172.20.10.4.57843: Flags [P.], seq 5489:5535, ack 5596, win 459, options [nop,nop,TS val 1528232788 ecr 709387913], length 46
20:54:45.610308 IP 172.20.10.4.57843 > mia07s35-in-f110.1e100.net.https: Flags [.], ack 5535, win 4094, options [nop,nop,TS val 709388070 ecr 1528232788], length 0
20:54:45.638830 IP mia07s35-in-f110.1e100.net.https > 172.20.10.4.57843: Flags [.], ack 5634, win 459, options [nop,nop,TS val 1528232818 ecr 709388028], length 0
20:54:45.677917 IP mia07s35-in-f110.1e100.net.https > 172.20.10.4.57843: Flags [.], ack 5680, win 459, options [nop,nop,TS val 1528232858 ecr 709388070], length 0
20:54:45.678003 IP 172.20.10.4.57843 > mia07s35-in-f110.1e100.net.https: Flags [P.], seq 5680:5726, ack 5535, win 4096, options [nop,nop,TS val 709388138 ecr 1528232858], length 46
20:54:45.759617 IP mia07s35-in-f110.1e100.net.https > 172.20.10.4.57843: Flags [.], ack 5726, win 459, options [nop,nop,TS val 1528232938 ecr 709388138], length 0
20:54:45.798597 IP 172.20.10.4.32688 > 172.20.10.1.domain: 37193+ A? mail.google.com. (33)
20:54:45.799217 IP 172.20.10.4.57494 > mia07s35-in-f101.1e100.net.https: Flags [P.], seq 1525814534:1525815558, ack 1118711254, win 4096, options [nop,nop,TS val 709388258 ecr 1528071148], length 1024
20:54:45.799253 IP 172.20.10.4.57494 > mia07s35-in-f101.1e100.net.https: Flags [.], seq 1024:2422, ack 1, win 4096, options [nop,nop,TS val 709388258 ecr 1528071148], length 1398
20:54:45.799269 IP 172.20.10.4.57494 > mia07s35-in-f101.1e100.net.https: Flags [P.], seq 2422:2520, ack 1, win 4096, options [nop,nop,TS val 709388258 ecr 1528071148], length 98
20:54:45.867916 IP 172.20.10.1.domain > 172.20.10.4.32688: 37193 2/0/0 CNAME googlemail.l.google.com., A 216.58.219.133 (76)
20:54:45.870008 IP 172.20.10.4.56720 > mia07s26-in-f133.1e100.net.https: UDP, length 1350
20:54:45.921701 IP mia07s35-in-f101.1e100.net.https > 172.20.10.4.57494: Flags [.], ack 1024, win 614, options [nop,nop,TS val 1528188813 ecr 709388258], length 0
20:54:45.921737 IP mia07s35-in-f101.1e100.net.https > 172.20.10.4.57494: Flags [.], ack 2422, win 636, options [nop,nop,TS val 1528188813 ecr 709388258], length 0
20:54:45.921740 IP mia07s35-in-f101.1e100.net.https > 172.20.10.4.57494: Flags [.], ack 2520, win 636, options [nop,nop,TS val 1528188813 ecr 709388258], length 0
20:54:45.922326 IP mia07s35-in-f101.1e100.net.https > 172.20.10.4.57494: Flags [P.], seq 1:47, ack 2520, win 636, options [nop,nop,TS val 1528188814 ecr 709388258], length 46
20:54:45.922381 IP 172.20.10.4.57494 > mia07s35-in-f101.1e100.net.https: Flags [.], ack 47, win 4094, options [nop,nop,TS val 709388380 ecr 1528188814], length 0
20:54:45.950788 IP mia07s26-in-f133.1e100.net.https > 172.20.10.4.56720: UDP, length 1350
20:54:45.951565 IP 172.20.10.4.56720 > mia07s26-in-f133.1e100.net.https: UDP, length 37
20:54:46.314892 IP 172.20.10.4.57862 > 172.20.10.1.domain: 31668+ PTR? 81.156.16.199.in-addr.arpa. (44)
20:54:46.351836 IP mia07s35-in-f101.1e100.net.https > 172.20.10.4.57494: Flags [P.], seq 47:1431, ack 2520, win 636, options [nop,nop,TS val 1528189200 ecr 709388380], length 1384
20:54:46.351904 IP 172.20.10.4.57494 > mia07s35-in-f101.1e100.net.https: Flags [.], ack 1431, win 4052, options [nop,nop,TS val 709388810 ecr 1528189200], length 0
20:54:46.351954 IP mia07s35-in-f101.1e100.net.https > 172.20.10.4.57494: Flags [P.], seq 1431:1726, ack 2520, win 636, options [nop,nop,TS val 1528189200 ecr 709388380], length 295
20:54:46.351960 IP mia07s35-in-f101.1e100.net.https > 172.20.10.4.57494: Flags [P.], seq 1726:2888, ack 2520, win 636, options [nop,nop,TS val 1528189200 ecr 709388380], length 1162
20:54:46.351963 IP mia07s35-in-f101.1e100.net.https > 172.20.10.4.57494: Flags [P.], seq 2888:2934, ack 2520, win 636, options [nop,nop,TS val 1528189200 ecr 709388380], length 46
20:54:46.352004 IP 172.20.10.4.57494 > mia07s35-in-f101.1e100.net.https: Flags [.], ack 1726, win 4043, options [nop,nop,TS val 709388810 ecr 1528189200], length 0
20:54:46.352063 IP 172.20.10.4.57494 > mia07s35-in-f101.1e100.net.https: Flags [.], ack 2888, win 4007, options [nop,nop,TS val 709388810 ecr 1528189200], length 0
20:54:46.352081 IP 172.20.10.4.57494 > mia07s35-in-f101.1e100.net.https: Flags [.], ack 2934, win 4005, options [nop,nop,TS val 709388810 ecr 1528189200], length 0
20:54:46.352172 IP 172.20.10.4.57494 > mia07s35-in-f101.1e100.net.https: Flags [.], ack 2934, win 4096, options [nop,nop,TS val 709388810 ecr 1528189200], length 0
20:54:46.353141 IP 172.20.10.4.57494 > mia07s35-in-f101.1e100.net.https: Flags [P.], seq 2520:2566, ack 2934, win 4096, options [nop,nop,TS val 709388811 ecr 1528189200], length 46
20:54:46.483074 IP mia07s35-in-f101.1e100.net.https > 172.20.10.4.57494: Flags [.], ack 2566, win 636, options [nop,nop,TS val 1528189375 ecr 709388811], length 0
20:54:46.765161 IP 172.20.10.4.57839 > 199.15.213.3.https: Flags [F.], seq 3466740002, ack 3969872440, win 65535, options [nop,nop,TS val 709389221 ecr 127057077], length 0
20:54:46.908019 IP 199.15.213.3.https > 172.20.10.4.57839: Flags [.], ack 1, win 4699, options [nop,nop,TS val 127075614 ecr 709389221], length 0
20:54:46.908065 IP 172.20.10.4.57839 > 199.15.213.3.https: Flags [.], ack 1, win 65535, options [nop,nop,TS val 709389364 ecr 127075614], length 0
20:54:46.908087 IP 199.15.213.3.https > 172.20.10.4.57839: Flags [F.], seq 1, ack 1, win 4699, options [nop,nop,TS val 127075614 ecr 709389221], length 0
20:54:46.908106 IP 172.20.10.4.57839 > 199.15.213.3.https: Flags [.], ack 2, win 65535, options [nop,nop,TS val 709389364 ecr 127075614], length 0
20:54:47.043185 IP 199.16.156.81.https > 172.20.10.4.57549: Flags [P.], seq 1810210245:1810210298, ack 946921514, win 72, options [nop,nop,TS val 2348594562 ecr 709381016], length 53
20:54:47.043251 IP 172.20.10.4.57549 > 199.16.156.81.https: Flags [.], ack 53, win 4094, options [nop,nop,TS val 709389499 ecr 2348594562], length 0
20:54:47.043283 IP 199.16.156.81.https > 172.20.10.4.57549: Flags [P.], seq 53:106, ack 1, win 72, options [nop,nop,TS val 2348594562 ecr 709381016], length 53
20:54:47.043305 IP 172.20.10.4.57549 > 199.16.156.81.https: Flags [.], ack 106, win 4092, options [nop,nop,TS val 709389499 ecr 2348594562], length 0
20:54:47.043761 IP 199.16.156.81.https > 172.20.10.4.57549: Flags [P.], seq 106:159, ack 1, win 72, options [nop,nop,TS val 2348594562 ecr 709381016], length 53
20:54:47.043783 IP 172.20.10.4.57549 > 199.16.156.81.https: Flags [.], ack 159, win 4094, options [nop,nop,TS val 709389499 ecr 2348594562], length 0
20:54:47.193327 IP 146.185.167.158.https > 172.20.10.4.57659: Flags [F.], seq 4144552489, ack 2345835258, win 166, options [nop,nop,TS val 703986001 ecr 709339950], length 0
20:54:47.193382 IP 172.20.10.4.57659 > 146.185.167.158.https: Flags [.], ack 1, win 4096, options [nop,nop,TS val 709389648 ecr 703986001], length 0
20:54:47.193805 IP 172.20.10.4.57659 > 146.185.167.158.https: Flags [F.], seq 1, ack 1, win 4096, options [nop,nop,TS val 709389648 ecr 703986001], length 0
20:54:47.385538 IP 146.185.167.158.https > 172.20.10.4.57659: Flags [R], seq 4144552490, win 0, length 0
20:54:47.390756 IP 172.20.10.4.57862 > 172.20.10.1.domain: 31668+ PTR? 81.156.16.199.in-addr.arpa. (44)
20:54:49.625547 IP 172.20.10.4.57532 > r-199-59-148-21.twttr.com.https: Flags [P.], seq 10707:11544, ack 8135, win 4194, options [nop,nop,TS val 709392078 ecr 2764543732], length 837
20:54:49.625719 IP 172.20.10.4.57532 > r-199-59-148-21.twttr.com.https: Flags [P.], seq 11544:12589, ack 8135, win 4194, options [nop,nop,TS val 709392078 ecr 2764543732], length 1045
20:54:49.871696 IP r-199-59-148-21.twttr.com.https > 172.20.10.4.57532: Flags [.], ack 12589, win 1701, options [nop,nop,TS val 2764551336 ecr 709392078], length 0
20:54:49.871728 IP r-199-59-148-21.twttr.com.https > 172.20.10.4.57532: Flags [P.], seq 8135:8460, ack 12589, win 1701, options [nop,nop,TS val 2764551345 ecr 709392078], length 325
20:54:49.871755 IP 172.20.10.4.57532 > r-199-59-148-21.twttr.com.https: Flags [.], ack 8460, win 4183, options [nop,nop,TS val 709392324 ecr 2764551345], length 0
20:54:49.977238 IP 172.20.10.1.domain > 172.20.10.4.57862: 31668 NXDomain 0/1/0 (114)
20:54:49.978359 IP 172.20.10.4.60360 > 172.20.10.1.domain: 9767+ PTR? 141.21.125.74.in-addr.arpa. (44)
20:54:51.031043 IP 172.20.10.4.60360 > 172.20.10.1.domain: 9767+ PTR? 141.21.125.74.in-addr.arpa. (44)
20:54:51.663667 IP 199.16.156.81.https > 172.20.10.4.57553: Flags [P.], seq 1780784367:1780784420, ack 1889479817, win 67, options [nop,nop,TS val 2322960255 ecr 709378004], length 53
20:54:51.663728 IP 172.20.10.4.57553 > 199.16.156.81.https: Flags [.], ack 53, win 4094, options [nop,nop,TS val 709394114 ecr 2322960255], length 0
20:54:51.672202 IP 199.16.156.81.https > 172.20.10.4.57553: Flags [P.], seq 53:106, ack 1, win 67, options [nop,nop,TS val 2322960255 ecr 709378004], length 53
20:54:51.672259 IP 172.20.10.4.57553 > 199.16.156.81.https: Flags [.], ack 106, win 4094, options [nop,nop,TS val 709394122 ecr 2322960255], length 0
20:54:51.672285 IP 199.16.156.81.https > 172.20.10.4.57553: Flags [P.], seq 106:159, ack 1, win 67, options [nop,nop,TS val 2322960255 ecr 709378004], length 53
20:54:51.672303 IP 172.20.10.4.57553 > 199.16.156.81.https: Flags [.], ack 159, win 4092, options [nop,nop,TS val 709394122 ecr 2322960255], length 0
20:54:53.200917 IP ec2-107-20-158-245.compute-1.amazonaws.com.https > 172.20.10.4.57729: Flags [P.], seq 2538067194:2538067225, ack 64716983, win 94, options [nop,nop,TS val 785278650 ecr 709335470], length 31
20:54:53.200993 IP 172.20.10.4.57729 > ec2-107-20-158-245.compute-1.amazonaws.com.https: Flags [.], ack 31, win 4095, options [nop,nop,TS val 709395650 ecr 785278650], length 0
20:54:53.312551 IP 172.20.10.4.57017 > 104.41.207.33.https: Flags [P.], seq 1102372530:1102372855, ack 3886565239, win 4096, options [nop,nop,TS val 709395761 ecr 62516571], length 325
20:54:53.313468 IP 172.20.10.4.51357 > 172.20.10.1.domain: 50955+ A? prodloginserver.cloudapp.net. (46)
20:54:53.313763 IP 172.20.10.4.50964 > 172.20.10.1.domain: 61224+ AAAA? prodloginserver.cloudapp.net. (46)
20:54:53.316060 IP 172.20.10.4.54589 > 172.20.10.1.domain: 55064+ AAAA? prodstorage2server.cloudapp.net. (49)
20:54:53.422312 IP 172.20.10.1.domain > 172.20.10.4.50964: 61224 0/0/0 (46)
20:54:53.424677 IP 172.20.10.1.domain > 172.20.10.4.51357: 50955 1/0/0 A 23.101.56.70 (62)
20:54:53.425363 IP 172.20.10.4.57844 > 23.101.56.70.https: Flags [S], seq 1733394083, win 65535, options [mss 1460,nop,wscale 5,nop,nop,TS val 709395873 ecr 0,sackOK,eol], length 0
20:54:53.500461 IP 199.27.76.249.https > 172.20.10.4.57727: Flags [P.], seq 2605092035:2605092066, ack 3679087948, win 63, options [nop,nop,TS val 1141590331 ecr 709335305], length 31
20:54:53.500638 IP 172.20.10.4.57727 > 199.27.76.249.https: Flags [.], ack 31, win 4095, options [nop,nop,TS val 709395948 ecr 1141590331], length 0
20:54:53.500702 IP 199.27.76.249.https > 172.20.10.4.57727: Flags [F.], seq 31, ack 1, win 63, options [nop,nop,TS val 1141590331 ecr 709335305], length 0
20:54:53.500771 IP 172.20.10.4.57727 > 199.27.76.249.https: Flags [.], ack 32, win 4095, options [nop,nop,TS val 709395948 ecr 1141590331], length 0
20:54:53.501387 IP 172.20.10.4.57727 > 199.27.76.249.https: Flags [F.], seq 1, ack 32, win 4096, options [nop,nop,TS val 709395948 ecr 1141590331], length 0
20:54:53.526179 IP 104.41.207.33.https > 172.20.10.4.57017: Flags [.], seq 1:1399, ack 325, win 510, options [nop,nop,TS val 62518596 ecr 709395761], length 1398
20:54:53.526271 IP 104.41.207.33.https > 172.20.10.4.57017: Flags [.], seq 1399:2797, ack 325, win 510, options [nop,nop,TS val 62518596 ecr 709395761], length 1398
20:54:53.526279 IP 104.41.207.33.https > 172.20.10.4.57017: Flags [.], seq 2797:4195, ack 325, win 510, options [nop,nop,TS val 62518596 ecr 709395761], length 1398
20:54:53.526283 IP 104.41.207.33.https > 172.20.10.4.57017: Flags [P.], seq 4195:4710, ack 325, win 510, options [nop,nop,TS val 62518596 ecr 709395761], length 515
20:54:53.526328 IP 172.20.10.4.57017 > 104.41.207.33.https: Flags [.], ack 2797, win 4008, options [nop,nop,TS val 709395973 ecr 62518596], length 0
20:54:53.526415 IP 172.20.10.4.57017 > 104.41.207.33.https: Flags [.], ack 4710, win 3948, options [nop,nop,TS val 709395973 ecr 62518596], length 0
20:54:53.526448 IP 172.20.10.4.57017 > 104.41.207.33.https: Flags [.], ack 4710, win 4096, options [nop,nop,TS val 709395973 ecr 62518596], length 0
20:54:53.526562 IP 104.41.207.33.https > 172.20.10.4.57017: Flags [P.], seq 4710:4779, ack 325, win 510, options [nop,nop,TS val 62518596 ecr 709395761], length 69
20:54:53.526609 IP 172.20.10.4.57017 > 104.41.207.33.https: Flags [.], ack 4779, win 4093, options [nop,nop,TS val 709395973 ecr 62518596], length 0
20:54:53.547816 IP 172.20.10.1.domain > 172.20.10.4.60360: 9767 1/0/0 PTR yv-in-f141.1e100.net. (78)
20:54:53.549037 IP 172.20.10.4.52321 > 172.20.10.1.domain: 55533+ PTR? 72.236.166.54.in-addr.arpa. (44)
20:54:53.620144 IP 199.27.76.249.https > 172.20.10.4.57727: Flags [.], ack 2, win 63, options [nop,nop,TS val 1141590362 ecr 709395948], length 0
20:54:53.622749 IP 23.101.56.70.https > 172.20.10.4.57844: Flags [S.], seq 3283102690, ack 1733394084, win 8192, options [mss 1410,nop,wscale 8,sackOK,TS val 14446666 ecr 709395873], length 0
